code;label_n1;label_n2;description;commentaire
/C2/;Commande et contrôle ;Commande et contrôle ;Commande et contrôle;
/CBRN/;Activités liées aux substances chimiques, bactériologiques, radioactives et nucléaires ;Activités liées aux substances chimiques, bactériologiques, radioactives et nucléaires ;Activités liées aux substances chimiques, bactériologiques, radioactives et nucléaires;
/FF/;Mission de lutte contre l'incendie ;Mission de lutte contre l'incendie ;Missions de lutte contre l'incendie;
/FSTT/;Intervention technique des services d'incendie ;Intervention technique des services d'incendie ;Intervention technique des services d'incendie;
/GEN/;Activités génériques ;Activités génériques ;Activités génériques;
/INT/;Renseignement ;Renseignement ;Renseignement;
/MAC/;Coopération multi-agences ;Coopération multi-agences ;Coopération multi-agences;
/MIL/;Activités militaires ;Activités militaires ;Activités militaires;
/NET/;Activités de réseau et de télécommunication ;Activités de réseau et de télécommunication ;Activités de réseau et de télécommunication;
/OPR/;Utilisation des ressources opérationnelles ;Utilisation des ressources opérationnelles ;Utilisation des ressources opérationnelles;
/POL/;Activités de police ;Activités de police ;Activités de police;
/REC/;Activités de reconstruction/réhabilitation ;Activités de reconstruction/réhabilitation ;Activités de reconstruction/réhabilitation;
/RSC/;Activités de sauvetage ;Activités de sauvetage ;Activités de sauvetage;
/SAV/;Sauver et secourir des vies en danger ;Sauver et secourir des vies en danger ;Sauver et secourir des vies en danger;
/SCS/;Soutenir la sécurité communautaire ;Soutenir la sécurité communautaire ;Soutenir la sécurité communautaire;
/SOC/;Activités sociales et de communication médiatique ;Activités sociales et de communication médiatique ;Activités sociales et de communication médiatique;
/C2/DEBRIF;Commande et contrôle ;Débriefing ;"Un examen de la réponse à un incident par l'ensemble des agences impliquées peut être désigné comme un ""débriefing à chaud"" ayant lieu sur le lieu de l'incident avant que les ressources aient quitté la scène.";
/C2/DNRSKA;Commande et contrôle ;Évaluation dynamique des risques ;Une évaluation du niveau de risque à différentes étapes d'un incident d'urgence.;
/C2/INASSM;Commande et contrôle ;Évaluation initiale ;"Partie du processus d'évaluation du risque ""dynamique"" réalisée par le commandant des opérations lors de la première intervention.";
/C2/OIC;Commande et contrôle ;Commande opérationnelle de l'incident ;Système de travail sûr utilisé pour gérer un incident d'urgence.;
/C2/POA;Commande et contrôle ;Actions post-incident ;Activités suivant un incident telles que l'enquête.;
/C2/THRTAS;Commande et contrôle ;Évaluation des menaces ;Une composante du processus d'évaluation du risque qui identifie les menaces évaluées pour des actions futures.;
/CBRN/CBRNCH;Activités liées aux substances chimiques, bactériologiques, radioactives et nucléaires ;CBRN, décontamination chimique ;La capacité de rendre toute personne, objet ou zone sécurisé en absorbant, détruisant, neutralisant, rendant inoffensif ou en éliminant les agents chimiques.;
/CBRN/CBRNDC;Activités liées aux substances chimiques, bactériologiques, radioactives et nucléaires ;CBRN, décontamination ;La capacité de rendre toute personne, objet ou zone sécurisé en absorbant, détruisant, neutralisant, rendant inoffensif ou en éliminant les agents chimiques ou biologiques, ou en éliminant les matières radioactives collant à celles-ci ou à leur environnement.;
/CBRN/NTRCH;Activités liées aux substances chimiques, bactériologiques, radioactives et nucléaires ;Neutraliser, chimique ;Sécuriser ou désintoxiquer un objet contaminé par un agent chimique.;
/CBRN/NUCWS;Activités liées aux substances chimiques, bactériologiques, radioactives et nucléaires ;Élimination des déchets nucléaires ;Élimination des substances contaminées par des matières nucléaires vers une zone de stockage désignée.;
/FF/IN;Mission de lutte contre l'incendie ;Lutte contre l'incendie industriel ;Lutte contre l'incendie dans les locaux industriels.;
/FF/OA;Mission de lutte contre l'incendie ;Lutte contre l'incendie en espace ouvert ;Lutte contre l'incendie en espace ouvert.;
/FF/SALVAG;Mission de lutte contre l'incendie ;Sauvetage ;Opérations visant à protéger les bâtiments et les biens contre les incendies et les inondations.;
/FF/STR;Mission de lutte contre l'incendie ;Lutte contre l'incendie structurel ;Lutte contre l'incendie dans les structures et les bâtiments.;
/FF/TRP;Mission de lutte contre l'incendie ;Lutte contre l'incendie de transport ;Lutte contre l'incendie impliquant des transports.;
/FSTT/DI;Intervention technique des services d'incendie ;Intervention en cas de catastrophe ;Réponse aux catastrophes et fourniture de services d'urgence.;
/FSTT/RRHAZ;Intervention technique des services d'incendie ;Contrôle et/ou réduction des risques dans les incidents liés aux matières dangereuses ;Gestion des matières dangereuses lors des incidents.;
/FSTT/TA;Intervention technique des services d'incendie ;Assistance technique à la communauté ou à d'autres services publics ;Fournir une assistance technique dans une situation d'urgence.;
/GEN/AIRLAU;Activités génériques ;Activité de lancement d'aéronefs ;L'occurrence du décollage d'un ou de plusieurs aéronefs.;
/GEN/ASSMBL;Activités génériques ;Assemblage ;Réunion de plusieurs objets dans la même zone.;
/GEN/CRWDCT;Activités génériques ;Contrôle de foule ;Restriction du mouvement d'un grand groupe de personnes.;
/GEN/DEMO;Activités génériques ;Démolition ;La destruction de structures, d'installations ou de matériels par utilisation du feu, de l'eau, d'explosifs, de moyens mécaniques ou d'autres moyens.;
/GEN/DEPLOY;Activités génériques ;Déploiement ;Le déploiement de ressources sur un incident. Aussi connu sous le nom de mobilisation.;
/GEN/DSTRBT;Activités génériques ;Distribution ;Diviser ou distribuer en portions.;
/GEN/FINANC;Activités génériques ;Finance ;La capacité de fournir des conseils financiers et une orientation, un soutien pour le processus d'approvisionnement, la fourniture de salaires et de soutien aux dépenses.;
/GEN/MARKNG;Activités génériques ;Marquage ;Rendre visible (par l'utilisation de la lumière/IR/laser/artillerie) un objet afin de permettre son identification par un autre objet.;
/GEN/MOVE;Activités génériques ;Déplacement ;Changement de position d'un endroit à un autre.;
/GEN/RECVRN;Activités génériques ;Récupération ;Récupération de tout objet perdu, incapacité ou capturé.;
/GEN/RECVRY;Activités génériques ;Rétablissement ;La capacité de contacter, protéger et extraire le personnel, les petits groupes ou unités ou le matériel.;
/GEN/REDPLN;Activités génériques ;Redéploiement ;Transfert d'une unité, d'un individu ou de fournitures déployées dans une zone vers une autre zone ou vers un autre emplacement à l'intérieur de la zone, en vue d'une utilisation ultérieure.;
/GEN/REORGN;Activités génériques ;Réorganisation.;Changement de l'organisation des tâches pour une opération particulière (a lieu généralement avant une opération). Cela inclut le transfert de l'autorité.;
/GEN/REPAIR;Activités génériques ;Réparation ;Restauration d'un élément en état de marche en corrigeant une défaillance spécifique ou une condition hors service.;
/GEN/RESPLN;Activités génériques ;Réapprovisionnement ;Reconstitution des stocks afin de maintenir les niveaux d'approvisionnement requis.;
/GEN/RESTNG;Activités génériques ;Repos ;Observation d'une période d'inactivité spécifiée par une organisation qui est hors de contact avec l'ennemi.;
/GEN/RETIRE;Activités génériques ;Retraite ;Déplacement d'une force hors de contact avec l'attente de ne plus avoir de contact significatif.;
/GEN/RLFPLC;Activités génériques ;Relève sur place ;Une opération dans laquelle, sur ordre d'une autorité supérieure, tout ou partie d'une unité est remplacé dans une zone par l'unité entrante. Les responsabilités des éléments remplacés pour la mission et la zone d'opérations assignée sont transférées à l'unité entrante. L'unité entrante poursuit l'opération conformément aux ordres.;
/GEN/RNDZVS;Activités génériques ;Rendez-vous ;Atteindre une réunion préalablement organisée à un moment et à un endroit donnés.;
/GEN/SCNMNG;Activités génériques ;Gestion de scène ;Le contrôle du lieu de l'incident d'urgence.;
/GEN/SECRNG;Activités génériques ;Sécurisation ;Prendre possession d'une position ou d'une caractéristique de terrain, avec ou sans recours à la force, et prendre des dispositions pour empêcher, dans la mesure du possible, sa destruction ou sa perte.;
/GEN/STNGUP;Activités génériques ;Mise en place ;Établir une installation, une organisation ou une caractéristique.;
/GEN/SUPRTN;Activités génériques ;Soutien ;Aider, protéger, compléter ou soutenir un objet.;
/GEN/TRNSPN;Activités génériques ;Transport ;Déplacer des actifs vers un objectif spécifié par mer, terre ou air.;
/INT/BIOSMP;Renseignement ;Échantillonnage biologique ;L'action de détecter un contaminant biologique.;
/INT/CHMSMP;Renseignement ;Échantillonnage chimique ;L'action de détecter un contaminant chimique.;
/INT/IDENT;Renseignement ;Identification ;Déterminer l'identification d'une classe d'objet particulière, reconnaître le caractère amical ou ennemi d'un objet ou détecter la présence d'un objet.;
/INT/ILLUMN;Renseignement ;Éclairage ;Fournir un éclairage en utilisant des projecteurs de recherche ou des illuminants pyrotechniques par diffusion ou réflexion.;
/INT/LOCTNG;Renseignement ;Localisation ;Établir la position d'un objet.;
/INT/NUCSMP;Renseignement ;Échantillonnage nucléaire ;L'action de détecter un contaminant radiologique.;
/INT/OBSRNG;Renseignement ;Observation ;Fournir une vue continue et la possibilité de rapports sur l'activité d'un objet.;
/INT/PLUMOD;Renseignement ;Modélisation de panache ;Projection informatique de la zone affectée après un incident de pollution ou de contamination, utilisée pour prédire quelles zones peuvent nécessiter une évacuation.;
/INT/PTRLNG;Renseignement ;Patrouille ;Rassembler des informations ou mener une mission destructrice, harassante, de ratissage ou de sécurité.;
/INT/RECCE;Renseignement ;Reconnaissance ;Mener une mission visant à obtenir par des opérations visuelles ou d'autres méthodes de détection des informations sur l'état d'un événement donné, ou à recueillir des données sur les caractéristiques météorologiques, hydrographiques ou géographiques d'une zone particulière.;
/INT/SRVMET;Renseignement ;Surveillance météorologique ;La capacité à effectuer une observation systématique des conditions météorologiques.;
/INT/SRVSEN;Renseignement ;Surveillance par capteur ;La capacité à gérer, exploiter et entretenir des actifs de surveillance par capteur.;
/INT/WITNSN;Renseignement ;Témoin ;Observer une activité qui pourrait nécessiter la fourniture de preuves.;
/MAC/AII;Coopération multi-agences ;Assistance à l'enquête sur l'incident ;Personnel spécialement formé fournissant une assistance dans le cadre des enquêtes sur les incidents.;
/MAC/COL;Coopération multi-agences ;Coordination avec d'autres agences ;Liaison et coopération entre différentes agences.;
/MIL/BCESC;Activités militaires ;Traversée de la frontière, escortée ;Une traversée de frontière qui est effectuée sous escorte.;
/MIL/BLOCKN;Activités militaires ;Blocage ;Empêcher l'accès de l'ennemi à une zone ou empêcher sa progression dans une direction ou le long d'une voie d'approche.;
/MIL/BOMBNG;Activités militaires ;Bombardement ;Attaquer, endommager ou détruire à l'aide de bombes.;
/MIL/CAPTUR;Activités militaires ;Capture ;Prendre possession d'un objet, généralement par la force, impliquant fréquemment un mouvement en tant que phase préliminaire.;
/MIL/CTRATK;Activités militaires ;Contre-attaque ;Lancer une opération offensive dans laquelle une attaque par tout ou partie d'une force défensive est dirigée contre une force ennemie attaquante, dans le but spécifique de regagner le terrain perdu, de couper ou de détruire les unités ennemies de tête, et avec l'objectif général de reprendre l'initiative et de priver l'ennemi de l'atteinte de son but ou de son objectif d'attaque.;
/MIL/DEFEND;Activités militaires ;Défense ;Protéger un objet défini contre une attaque ennemie.;
/MIL/DISENG;Activités militaires ;Désengagement ;Mettre fin à une action.;
/MIL/DIVRSN;Activités militaires ;Diversion ;Rendre inefficace ou inutilisable dans le cadre d'opérations militaires.;
/MIL/DLBATK;Activités militaires ;Attaque ;Mettre des bombes, des mines, des missiles et des pièges hors service.;
/MIL/DSRPTN;Activités militaires ;Perturbation ;Le contrôle du lieu de l'incident d'urgence.;
/MIL/ENVLPN;Activités militaires ;Enveloppement ;Protection d'une scène pour préserver les preuves.;
/MIL/FIX;Activités militaires ;Fixation ;"Terme indiquant que les personnes dans une zone donnée doivent rester chez elles, fermer toutes les portes et fenêtres et écouter la station de radio locale pour de plus amples informations. Connu également sous le nom de ""Confinement"" (Portugal) utilisé au Portugal pour indiquer la zone affectée où les gens doivent entrer, rester à l'intérieur et écouter.";
/MIL/HARASS;Activités militaires ;Harcèlement ;La cessation des activités de guerre.;
/MIL/HIDE;Activités militaires ;Cachette ;Désengager une force en contact avec une force ennemie.;
/MIL/HLDDEF;Activités militaires ;Maintien en position défensive ;Éliminer ou neutraliser un obstacle.;
/MIL/HLDOFF;Activités militaires ;Maintien en position offensive ;La réactivation de la transmission de l'information.;
/MIL/INFLTN;Activités militaires ;Infiltration ;La rétablissement de la capacité de communication.;
/MIL/INTCPN;Activités militaires ;Interception ;Construction, érection ou création d'un objet.;
/MIL/INTDCT;Activités militaires ;Interdiction ;La capacité de construire diverses installations en soutien direct des opérations militaires.;
/MIL/MASFOR;Activités militaires ;Concentration de forces ;La capacité de construire diverses installations en soutien direct des opérations navales.;
/MIL/MIL;Activités militaires ;Missions spécifiques militaires ;Achat de tout ce qui est nécessaire pour accomplir une action particulière.;
/MIL/WPNFIR;Activités militaires ;Tir d'armes ;Le tir d'armes.;
/NET/COMDEA;Activités de réseau et de télécommunication ;Désactivation des communications ;La désactivation de la transmission d'informations.;
/NET/DATTRF;Activités de réseau et de télécommunication ;Transfert de données ;Un service pour le transfert électronique de données.;
/NET/NETJAM;Activités de réseau et de télécommunication ;Brouillage de réseau ;;
/NET/NETSEI;Activités de réseau et de télécommunication ;Saisie de réseau ;;
/NET/SGNC;Activités de réseau et de télécommunication ;Centre de nœud de signal ;La capacité des services de transmission à gérer, exploiter et contrôler un centre de nœuds de communication.;
/NET/SGNLE;Activités de réseau et de télécommunication ;Extension importante du nœud de signal ;La capacité des services de transmission à gérer, exploiter et contrôler un grand nœud de communication.;
/POL/NTRCOM;Activités de police ;Neutralisation, combat ;Rendre inefficace ou inutilisable dans les opérations militaires ;
/POL/NTREXP;Activités de police ;Neutralisation, explosive ;Mettre hors service les bombes, les mines, les missiles et les pièges explosifs en toute sécurité ;
/POL/SCNMNG;Activités de police ;Gestion de scène ;Le contrôle du site de l'incident d'urgence ;
/POL/SCNPRS;Activités de police ;Préservation de la scène ;Protection d'une scène pour préserver les preuves ;
/POL/SHELTR;Activités de police ;Hébergement ;"Terme indiquant que les personnes dans une zone ou une zone donnée doivent rester chez elles, fermer toutes les portes et fenêtres et régler leur poste de radio local pour de plus amples informations. Connu également sous le nom de ""Confinement"" (Portugal) Utilisé au Portugal pour indiquer la zone affectée où les personnes doivent entrer, rester à l'intérieur et régler leur poste de radio ";
/POL/SUSHOS;Activités de police ;Suspension des hostilités ;La cessation des activités de guerre ;
/POL/WITDRL;Activités de police ;Retrait ;Désengager une force en contact avec une force ennemie ;
/REC/CLROBS;Activités de reconstruction/réhabilitation ;Déblaiement (obstacle) ;Éliminer ou neutraliser un obstacle ;
/REC/COMACT;Activités de reconstruction/réhabilitation ;Activation des communications ;La réactivation de la transmission de l'information ;
/REC/COMRES;Activités de reconstruction/réhabilitation ;Restauration des communications ;La rétablissement de la capacité de communiquer ;
/REC/CONSTN;Activités de reconstruction/réhabilitation ;Construction ;Construction, érection ou création d'un objet ;
/REC/ENGCN;Activités de reconstruction/réhabilitation ;Génie, construction ;La capacité de construire diverses installations en soutien direct des opérations militaires ;
/REC/ENGCNN;Activités de reconstruction/réhabilitation ;Génie, construction navale ;La capacité de construire diverses installations en soutien direct des opérations navales ;
/REC/PROCUR;Activités de reconstruction/réhabilitation ;Approvisionnement ;Acheter tout ce qui est nécessaire pour accomplir une action particulière ;
/REC/PRVACC;Activités de reconstruction/réhabilitation ;Fourniture d'hébergement ;Fournir un espace pour recevoir des personnes, en particulier un lieu de vie ou de logement ;
/REC/PRVAGR;Activités de reconstruction/réhabilitation ;Fourniture de soutien agricole ;Fournir des conseils ou des fournitures pour cultiver le sol et élever des animaux.;
/REC/PRVBDD;Activités de reconstruction/réhabilitation ;Fourniture de literie ;Fournir de l'espace pour accueillir des personnes, notamment un lieu de vie ou de logement.;
/REC/PRVCMP;Activités de reconstruction/réhabilitation ;Fourniture de camps ;Fournir un logement temporaire de divers types, généralement constitué de huttes ou de tentes, pour les détenus, les personnes sans-abri et d'autres utilisations d'urgence.;
/REC/PRVCNS;Activités de reconstruction/réhabilitation ;Fourniture de services de construction ;Fournir de la main-d'œuvre et du matériel pour la construction d'installations.;
/REC/PRVDCN;Activités de reconstruction/réhabilitation ;Fourniture de services de décontamination ;Fournir la purification de différents articles contaminés.;
/REC/PRVEDU;Activités de reconstruction/réhabilitation ;Fourniture de services éducatifs ;Fournir de la main-d'œuvre et du matériel pour le processus éducatif.;
/REC/PRVHLT;Activités de reconstruction/réhabilitation ;Fourniture de services de santé ;Fournir de la main-d'œuvre et du matériel pour le maintien de la santé et du bien-être général.;
/REC/PRVHSN;Activités de reconstruction/réhabilitation ;Fourniture de soutien de la nation hôte ;Fournir une assistance civile et/ou militaire fournie par une nation aux forces étrangères sur son territoire en temps de paix, en temps de crise ou d'urgence, ou en temps de guerre, sur la base d'accords mutuellement conclus entre les nations.;
/REC/PRVINF;Activités de reconstruction/réhabilitation ;Fourniture d'infrastructures ;Fournir des installations de base telles que des routes, des ponts et des égouts.;
/REC/PRVLND;Activités de reconstruction/réhabilitation ;Fourniture de services de blanchisserie.;Fournir de la main-d'œuvre et du matériel pour le lavage de vêtements ou de linge.;
/REC/PRVRPR;Activités de reconstruction/réhabilitation ;Fourniture de services de réparation ;Fournir de la main-d'œuvre et du matériel pour remettre des objets en bon état.;
/REC/PRVSCY;Activités de reconstruction/réhabilitation ;Fourniture de services de sécurité ;Fournir de la main-d'œuvre et du matériel pour assurer la sécurité du personnel et des installations.;
/REC/PRVSHL;Activités de reconstruction/réhabilitation ;Fourniture d'abris ;Fournir un logement.;
/REC/PRVSTG;Activités de reconstruction/réhabilitation ;Fourniture de services de stockage ;Fournir des services de stockage.;
/REC/PRVTRS;Activités de reconstruction/réhabilitation ;Fourniture de services de transbordement ;Fournir le mouvement de marchandises d'un navire ou d'un train à un autre pour un autre envoi.;
/REC/PSO;Activités de reconstruction/réhabilitation ;Soutien à la paix ;La capacité à mener des opérations multifonctionnelles impliquant des forces militaires et des agences diplomatiques et humanitaires. Les opérations sont conçues pour atteindre des objectifs humanitaires ou un règlement pacifique à long terme.;
/REC/SPLLDB;Activités de reconstruction/réhabilitation ;Approvisionnement en blanchisserie/bain ;La capacité à fournir des services de blanchisserie et/ou de bain.;
/REC/SPLWAT;Activités de reconstruction/réhabilitation ;Approvisionnement en eau ;La capacité à fournir de l'eau potable.;
/REC/UTILTY;Activités de reconstruction/réhabilitation ;Utilité ;La capacité à fournir des services publics (eau, gaz, électricité, etc.).;
/REC/WATER;Activités de reconstruction/réhabilitation ;Purification de l'eau ;La capacité à fournir de l'eau potable propre pour la boisson et la baignade.;
/RSC/COVERN;Activités de reconstruction/réhabilitation ;Couverture ;Opérer en tant que force distincte de la force principale pour protéger la force principale en gagnant du temps tout en observant et en rapportant des informations et en empêchant l'observation ennemie du feu direct contre la force principale.;
/RSC/FRFGTN;Activités de reconstruction/réhabilitation ;Lutte contre l'incendie ;L'activité d'extinction des incendies.;
/RSC/MEDEVC;Activités de reconstruction/réhabilitation ;Évacuation médicale ;Le processus de déplacement de toute personne blessée ou malade vers/entre les installations de traitement médical.;
/RSC/SAR;Activités de reconstruction/réhabilitation ;Recherche et sauvetage ;La capacité à utiliser des aéronefs, des navires, des sous-marins, des équipes de sauvetage spécialisées et de l'équipement pour rechercher et secourir des personnes en détresse sur terre ou en mer.;
/SAV/AR;Activités de sauvetage ;Sauvetage en ambulance ;Sauvetage effectué par le personnel du service d'ambulance.;
/SAV/ASC;Activités de sauvetage ;Assistance et soutien aux victimes ;Soins donnés aux victimes, tels que les premiers secours.;
/SAV/RHD;Activités de sauvetage ;Sauvetage en hauteur et en profondeur ;Unités de sauvetage spécialisées utilisant un équipement sur mesure.;
/SAV/RTA;Activités de sauvetage ;Sauvetage dans les accidents de la route ;Opérations de sauvetage d'urgence impliquant des victimes d'accidents de véhicules.;
/SAV/SARCSL;Activités de sauvetage ;Recherche et sauvetage en cas de structures effondrées et de glissements de terrain ;Opérations de recherche et de sauvetage dans des structures effondrées et des glissements de terrain.;
/SAV/SARHHA;Activités de sauvetage ;Recherche et sauvetage en atmosphères chaudes et dangereuses ;Procédures de recherche et de sauvetage d'urgence.;
/SAV/SRW;Activités de sauvetage ;Recherche et sauvetage en eau ;Opérations de recherche et de sauvetage d'urgence impliquant de l'eau.;
/SAV/USAR;Activités de sauvetage ;Recherche et sauvetage urbain (USAR) ;;
/SAV/UW;Activités de sauvetage ;Sauvetage sous-marin ;Sauvetages impliquant l'utilisation d'équipes spécialisées et d'équipement tels que des plongeurs.;
/SCS/EDU;Soutenir la sécurité communautaire ;Prévention des incendies et éducation du public à la sécurité incendie ;Système de structure de prévention des incendies et d'éducation du public en matière de sécurité incendie.;
/SOC/CNDCNF;Activités sociales et de communication médiatique ;Organisation de conférences ;Mener une réunion de discussion, en particulier une réunion régulière organisée par une association ou une organisation.;
/SOC/CNDMED;Activités sociales et de communication médiatique ;Interviews avec les médias ;Mener une conversation entre un journaliste, etc., et une personne d'intérêt public, utilisée comme base d'une diffusion ou d'une publication.;
/SOC/CNDRCR;Activités sociales et de communication médiatique ;Organisation d'activités récréatives ;Mener une activité rafraîchissante ou divertissante.;
/SOC/CNDSCL;Activités sociales et de communication médiatique ;Organisation d'événements sociaux ;Mener une réunion sociale, en particulier celle organisée par un club ou une congrégation.;
/SOC/CNDSPT;Activités sociales et de communication médiatique ;Organisation d'événements sportifs ;Mener un jeu ou une activité compétitive, en particulier une activité en plein air impliquant un effort physique, comme le cricket, le football, la course, la chasse, etc.;
/SOC/ISSMDA;Activités sociales et de communication médiatique ;Publication d'articles dans les médias ;Diffuser, publier ou mettre en circulation un essai non-fictionnel, en particulier un essai inclus avec d'autres dans un journal, un magazine ou un journal.;
/SOC/ISSMDD;Activités sociales et de communication médiatique ;Réalisation de documentaires médiatiques ;Diffuser, publier ou mettre en circulation un document sur un support médiatique qui fournit un enregistrement ou un rapport factuel.;
