Donnée (Niveau 1),Donnée (Niveau 2),Donnée (Niveau 3),Donnée (Niveau 4),Donnée (Niveau 5),Donnée (Niveau 6),Description,Balise,Cardinalité,Objet,Format (ou type),Détails de format
Identifiant affaire/dossier,,,,,,"A valoriser avec l'identifiant partagé de l'affaire/dossier, généré une seule fois par le système du partenaire qui recoit la primo-demande de secours (créateur du dossier). 
Il est valorisé comme suit lors de sa création : 
{pays}.{domaine}.{organisation}.{senderCaseId}

Il doit pouvoir être généré de façon décentralisée et ne présenter aucune ambiguïté.
 Il doit être unique dans l'ensemble des systèmes : le numéro de dossier fourni par celui qui génère l'identifiant partagé doit donc être un numéro unique dans son système.",caseId,1..1,,string,
ID Demande partagé,,,,,,"A valoriser avec l'identifiant unique partagé de la demande de ressource,  généré une seule fois par le système du partenaire qui émet la demande 
Il est valorisé comme suit lors de sa création : 
{orgID}.request.{ID unique de la demande dans le système émetteur}

OU - uniquement si un ID unique de la demande n'est pas disponible : 
OrgId émetteur}.request.{senderCaseId}.{numéro d’ordre chronologique}",requestId,1..1,,string,
Réponse à la demande de ressources,,,,,,Objet permettant de transmettre les détails de la réponse à une demande de ressource,response,1..1,X,response,Format datetime décrit dans le DSF
,Date Heure de réponse,,,,,Groupe date heure de début de la demande,datetime,1..1,,datetime,Format datetime décrit dans le DSF
,Réponse,,,,,"A valoriser avec la réponse apportée. Cf Nomenclature associée
ACCEPTEE, REFUSEE, PARTIELLE, DIFFEREE",answer,1..1,,string,"ENUM: ACCEPTEE, REFUSEE, PARTIELLE, DIFFEREE"
,Délai de réponse,,,,,"A valoriser avec le délai de réponse auquel s'engage l'expéditeur (en minutes),",deadline,0..1,,string,
,Précisions sur la réponse,,,,,Commentaire libre permettant d'apporter toutes précisions utiles à la réponse. Le motif de refus est notifié dans ce champ.,freetext,0..1,,string,
